{
  "$schema": "http://json-schema.org/draft-07/schema#",
  "title": "Projects",
  "description": "Schema describing the structure of projects.json entries used for rendering the projects page.",
  "type": "array",
  "items": {
    "type": "object",
    "required": ["title", "date", "summary", "image"],
    "properties": {
      "title": {
        "type": "string",
        "minLength": 1,
        "description": "Display name for the project card."
      },
      "date": {
        "type": "string",
        "pattern": "^\\d{4}/\\d{2}/\\d{2}$",
        "description": "Publication date in yyyy/mm/dd format."
      },
      "website": {
        "type": "string",
        "description": "Public marketing or product website for the project.",
        "default": ""
      },
      "href": {
        "type": "string",
        "description": "Link to the project codebase (public or private placeholder).",
        "default": ""
      },
      "image": {
        "type": "string",
        "minLength": 1,
        "description": "Path to the card background image."
      },
      "summary": {
        "type": "string",
        "minLength": 1,
        "description": "Short description shown on the card."
      },
      "private": {
        "type": "boolean",
        "description": "True when the codebase is proprietary and not publicly accessible.",
        "default": false
      }
    },
    "additionalProperties": false
  }
}
