[
  {
    "title": "Research comparing different self-learning formats",
    "date": "2022/10/06",
    "href": "https://docs.google.com/document/d/1B9prEXCYuyYHJnD4XMCF9n9nG4S0LA6F/edit?usp=sharing&ouid=104499564001865318513&rtpof=true&sd=true",
    "image": "./static/media/post_images/post_b2.png",
    "summary": "Inspired by how students have been actively learning with online resources due to the COVID-19 pandemic, I decided to investigate whether there was on optimal self-learning method for students to use through this research! It has been published to the Columbia Junior Science Journal for review."
  },
  {
    "title": "CS Society Curriculum",
    "date": "2022/10/06",
    "href": "https://docs.google.com/document/d/1ICCIfYhcbo42vPV1L0f7RhVIT0OdI4o-CrKOu5HeFv4/edit?usp=sharing",
    "image": "./static/media/post_images/post_b1.png",
    "summary": "The above link will send you to the course curriculum I created for my Computer Science Society at school."
  }
]
